{
  "version": 1,
  "heartbeat_sequence": 1449,
  "updated_at": "2026-05-17T09:24:01Z",
  "session": "S61",
  "session_deadline": "2026-04-14T06:00:00Z",
  "current_block": "W12",
  "current_block_label": "EID Scorer",
  "overall_status": "done",
  "agent": "Claude Opus 4.6 (1M context)",
  "methodology": "5-fase anti-bypass + M14 + multi-agent paralelo + multiprocessing.Pool(8)",
  "sub_blocks": [
    {
      "id": "W13.load",
      "label": "Load manuscript + refs + model_eval",
      "agent_type": "main",
      "status": "done",
      "output_refs": [
        "state/manuscript_v5_condensed.json"
      ]
    },
    {
      "id": "W13.score",
      "label": "Score 13 components",
      "agent_type": "sonnet x11",
      "status": "done",
      "detail": "asyncio fan-out",
      "output_refs": [
        "state/eid_score.json"
      ]
    },
    {
      "id": "W13.write",
      "label": "Persist eid_score.json",
      "agent_type": "main",
      "status": "done",
      "output_refs": [
        "state/eid_score.json"
      ]
    }
  ],
  "current_findings": [
    "B2-B5 ejecutados en paralelo con 4 Task tools · total ~60 min wall time (vs ~6-7h secuencial)",
    "Mapa workflow EXCEDIÓ spec: 69 nodos (mínimo 45) · 125 edges (mínimo 80) · Cytoscape+dagre",
    "Enciclopedia: 402 archivos reales procesados en 1.0s con multiprocessing.Pool(8)",
    "Paper parser: 43 párrafos (no 40) detectados · 3448 palabras · schema annotation ajustado a para_id max 60",
    "W14 orchestrator 758 LOC CRÍTICO listo · 11+2 sub-componentes score EID (decomposición en frontend)",
    "W15 Model Evaluator añadido (ajuste de alcance post-Gonzalo) · modo static/live auto-detect",
    "5 fixes de schema encyclopedia aplicados · 0 errores finales · todos los 6 schemas validan draft-07",
    "15 YAMLs parsean · 6 scripts Python nuevos compilan · 2 edits + 14 archivos nuevos al commit"
  ],
  "next_planned": [
    "Commit único B2-B5 con ~25 archivos",
    "B6 smoke tests 6 paralelos: live.html polling · encyclopedia árbol · workflow map · paper-current ntfy POST · W14 smoke run · deploy Pages",
    "Deploy Pages trigger manual · verificación URL pública",
    "HANDOFF.md con guía 5 pasos · ntfy notif final 'Sistema LIVE'"
  ],
  "tool_calls_total": 746,
  "files_touched": [
    "pipeline/repo/state/claude_live.json",
    "pipeline/repo/state/schemas/claude_live.schema.json",
    "pipeline/repo/state/schemas/encyclopedia.schema.json",
    "pipeline/repo/state/schemas/annotation_message_v1.schema.json",
    "pipeline/repo/state/encyclopedia.json",
    "pipeline/repo/state/manuscript_v5_condensed.json",
    "pipeline/repo/scripts/lib/claude_live.py",
    "pipeline/repo/scripts/lib/eid_score.py",
    "pipeline/repo/scripts/lib/annotations.py",
    "pipeline/repo/scripts/build_manuscript_json.py",
    "pipeline/repo/scripts/w11_encyclopedia_builder.py",
    "pipeline/repo/scripts/w12_annotation_listener.py",
    "pipeline/repo/scripts/w13_eid_scorer.py",
    "pipeline/repo/scripts/w14_master_orchestrator.py",
    "pipeline/repo/scripts/w15_model_evaluator.py",
    "pipeline/repo/.github/workflows/w11-encyclopedia.yml",
    "pipeline/repo/.github/workflows/w12-annotation.yml",
    "pipeline/repo/.github/workflows/w13-eid-scorer.yml",
    "pipeline/repo/.github/workflows/w14-master.yml",
    "pipeline/repo/.github/workflows/w15-model-eval.yml",
    "pipeline/repo/docs/index.html",
    "pipeline/repo/docs/CONTRACTS.md",
    "pipeline/repo/docs/live.html",
    "pipeline/repo/docs/encyclopedia.html",
    "pipeline/repo/docs/workflow.html",
    "pipeline/repo/docs/paper-current.html",
    "pipeline/repo/docs/paper-improved.html",
    "pipeline/repo/docs/state/workflow_nodes.json",
    "pipeline/repo/docs/encyc/ (20 files)"
  ],
  "active_terminal": "this instance (B5.5 merger done, entering B6 smoke+deploy)",
  "other_terminals": [
    "parallel instance editing manuscript in resultados/S49_ALERTAS/BLINDAJE_Q1/"
  ],
  "eta_estimate": {
    "optimistic_wall_time_min": 30,
    "pessimistic_wall_time_min": 60,
    "current_block_eta_min": 3
  },
  "m14_preflight": {
    "catalog_consulted": true,
    "catalog_path": "memory/CANONICAL_BLINDAJES_INDEX.md",
    "findings_classified": "N/A (infrastructure build)"
  }
}